栏目,发布时间,标题,来源媒体,摘要,URL,情感,置信度
证券要闻,2025-08-28 08:32:30,中信证券：业务准入加快推进 卫星产业拐点在即,界面新闻,中信证券研报称，8月27日，工信部印发《关于优化业务准入促进卫星通信产业发展的指导意见》，旨在有序推动卫星通信业务开放。卫星通信产业战略地位凸显，政策导向明确。展望后续，卫星通信产业业务准入工作正持续优化，牌照发放工作或将加快推进。国内行业层面，高频发射已至，产业拐点在即。建议关注卫星通信服务提供商、卫星通信运营及服务、卫星制造产业链、地面设备制造等领域的投资机遇。,"http://finance.eastmoney.com/news/1353,202508283498509284.html",positive (stars 4 and 5),0.5994661450386047
证券要闻,2025-08-28 08:32:20,中金：AI服务器电源是下一个千亿元市场,界面新闻,中金公司研报表示，AI服务器电源是下一个千亿元市场，根据测算市场规模有望于2025E-2027E快速提升，模组/芯片市场规模CAGR预计为110%/67%，核心受益环节集中在PSU、PDU、BBU及DC-DC（PDB+VRM）等器件。随着GaN/SiC渗透、800VHVDC+SST架构落地及智能电源管理普及，龙头厂商市占率与业绩有望提升，二线厂商或承接溢出订单。,"http://finance.eastmoney.com/news/1353,202508283498509393.html",positive (stars 4 and 5),0.9526700973510742
证券要闻,2025-08-28 08:32:14,中信证券：AI推动光纤量价齐升 关注空芯光纤新机遇,界面新闻,中信证券研报称，随着AI驱动数据中心互联需求的增加，光纤产业加速演进，微软等海外大厂加速布局空芯光纤，看好其技术标准化带动规模化应用不断落地。此外结合康宁2025年二季度财报，数据中心对光通信互联需求快速增长，看好长期“光进铜退”趋势不改，多模光纤有望加速放量。,"http://finance.eastmoney.com/news/1353,202508283498509481.html",positive (stars 4 and 5),0.9070407152175903
证券要闻,2025-08-28 08:27:47,中金：AI服务器电源是下一个千亿元市场,人民财讯,人民财讯8月28日电，中金公司研报认为，AI服务器电源是下一个千亿元市场，根据测算市场规模有望于2025年—2027年快速提升，模组、芯片市场规模CAGR预计为110%、67%，核心受益环节集中在PSU、PDU、BBU及DC-DC（PDB+VRM）等器件。,"http://finance.eastmoney.com/news/1353,202508283497240564.html",positive (stars 4 and 5),0.9433625340461731
证券要闻,2025-08-28 08:26:19,华泰证券：Meta新品即将亮相 看好AI+AR眼镜产业链,南方财经网,南方财经8月28日电，华泰证券研报指出，今年MetaConnect大会将于9月17日—18日拉开帷幕。据MetaCTO透露，会上Meta有望发布带显示智能眼镜Celeste、第三代RayBan-Meta眼镜以及运动款Oakley眼镜，并可能展示全新的“元宇宙软件”，从硬件、交互、软件层面重新定义AI眼镜。,"http://finance.eastmoney.com/news/1353,202508283497203521.html",positive (stars 4 and 5),0.9196568727493286
证券要闻,2025-08-28 08:26:16,国金证券：人工智能+政策出台 AI应用端有望加速落地,每日经济新闻,每经AI快讯，国金证券研报表示，创新应用中梳理出六大方向，实现智算平台的产品兑现；优化改进能够有三个维度的赋能，带动中长期的设备升级投资。,"http://finance.eastmoney.com/news/1353,202508283498509531.html",positive (stars 4 and 5),0.8603518009185791
证券要闻,2025-08-28 08:25:38,AI早报 | Meta AI眼镜预计今年三季度量产，售价约800美元；Anthropic称其阻止黑客利用Claude AI网络犯罪,界面新闻,郭明錤：MetaAI眼镜Hypernova今年三季度量产，售价约800美元8月27日，跟踪苹果产业链多年的天风国际证券分析师郭明錤发文称，Meta公司即将推出的AI眼镜Hypernova预计将在2025年第三季度开始量产，产品生命周期为两年，未来两年内的出货量约15-20万部。郭明錤称，AI将是Hypernova最重要的卖点。,"http://finance.eastmoney.com/news/1354,202508283497202955.html",positive (stars 4 and 5),0.9632871747016907
证券要闻,2025-08-28 08:24:00,券商晨会精华：头部企业重磅新品发布在即，看好AI+AR眼镜产业链,财联社,财联社8月28日讯，市场昨日午后跳水回落，沪指、深成指双双跌超1%。沪深两市全天成交额3.17万亿，较上个交易日放量4865亿。板块方面，CPO、稀土、半导体等板块涨幅居前，房地产、白酒、美容护理、创新药等板块跌幅居前。截至昨日收盘，沪指跌1.76%，深成指跌1.43%，创业板指跌0.69%。,"http://finance.eastmoney.com/news/1353,202508283497202211.html",positive (stars 4 and 5),0.6908125281333923
证券要闻,2025-08-28 08:23:26,中信证券：业务准入加快推进 卫星产业拐点在即,人民财讯,【中信证券：业务准入加快推进 卫星产业拐点在即】中信证券研报称，8月27日，工信部印发《关于优化业务准入促进卫星通信产业发展的指导意见》，旨在有序推动卫星通信业务开放。卫星通信产业战略地位凸显，政策导向明确。展望后续，卫星通信产业业务准入工作正持续优化，牌照发放工作或将加快推进。国内行业层面，高频发射已至，产业拐点在即。建议关注卫星通信服务提供商、卫星通信运营及服务、卫星制造产业链、地面设备制造等领域的投资机遇。,"http://finance.eastmoney.com/news/1353,202508283497201262.html",positive (stars 4 and 5),0.5762446522712708
证券要闻,2025-08-28 08:22:57,刚刚，突然大跌！,中国基金报,【导读】英伟达财报出炉，盘后股价大跌！中概股下挫昨晚美股市场不平静。首先，全市场都在等待的英伟达财报正式出炉！其次，昨夜中概股下挫。“外卖大战”让美团二季度净利润大降89%，京东、阿里巴巴收跌。新能源汽车股大跌。贝森特呼吁美联储内部审查，称肯定会在秋季知晓特朗普选择的美联储主席。关税方面，白宫贸易顾问称，如果印度停止购买俄罗斯石油，可获得25%的关税优惠。,"http://finance.eastmoney.com/news/1353,202508283497204068.html",positive (stars 4 and 5),0.6497654914855957
证券要闻,2025-08-28 08:22:31,国金证券：AI医疗已进入商业化加速期,人民财讯,人民财讯8月28日电，国金证券研报表示，尽管AI辅助诊断的底层需求广阔且明确，但纯粹的技术赋能故事已难以维系企业的长期发展。未来的投资价值将集中于那些能够将前沿技术（大模型能力、数据资产）与具体临床场景深度融合，并能清晰量化其产品价值（提升诊疗效率、优化患者预后、降低医疗成本）的企业。,"http://finance.eastmoney.com/news/1353,202508283497241724.html",positive (stars 4 and 5),0.9389371275901794
证券要闻,2025-08-28 08:22:23,中信证券：AI推动光纤量价齐升 关注空芯光纤新机遇,人民财讯,【中信证券：AI推动光纤量价齐升 关注空芯光纤新机遇】中信证券研报称，随着AI驱动数据中心互联需求的增加，光纤产业加速演进，微软等海外大厂加速布局空芯光纤，看好其技术标准化带动规模化应用不断落地。此外结合康宁2025年二季度财报，数据中心对光通信互联需求快速增长，看好长期“光进铜退”趋势不改，多模光纤有望加速放量。,"http://finance.eastmoney.com/news/1353,202508283497200948.html",positive (stars 4 and 5),0.8073219656944275
证券要闻,2025-08-28 06:03:33,8月28日国内四大证券报纸、重要财经媒体头版头条内容精华摘要,东方财富研究中心,【四大证券报纸、重要财经媒体头版头条摘要】1、促进服务出口若干政策措施近期将出台。2、工信部提出19项举措，促进卫星通信产业发展。3、前7月规上工业利润超4万亿，制造业引领复苏。4、证券交易印花税减半征收两年，为投资者减负逾2500亿元。,"http://finance.eastmoney.com/news/1345,202508283496993353.html",positive (stars 4 and 5),0.8391776084899902
证券要闻,2025-08-28 08:15:49,中金公司：AI服务器电源是下一个千亿元市场,第一财经,【中金公司：AI服务器电源是下一个千亿元市场】中金公司研报表示，AI服务器电源是下一个千亿元市场，根据测算市场规模有望于2025E-2027E快速提升，模组/芯片市场规模CAGR预计为110%/67%，核心受益环节集中在PSU、PDU、BBU及DC-DC（PDB+VRM）等器件。随着GaN/SiC渗透、800V HVDC+SST架构落地及智能电源管理普及，龙头厂商市占率与业绩有望提升，二线厂商或承接溢出订单。,"http://finance.eastmoney.com/news/1353,202508283497199651.html",positive (stars 4 and 5),0.9283151030540466
证券要闻,2025-08-28 06:00:54,东方财富财经早餐 8月28日周四,东方财富Choice数据,【东方财富财经早餐 8月28日周四】1、英伟达2026财年Q2营收467亿美元，公司批准额外600亿美元股票回购。2、工信部：推动手机等终端设备直连卫星加快推广应用。3、上海市发布关于加快推进城中村改造工作的实施意见。,"http://finance.eastmoney.com/news/1350,202508283497004795.html",positive (stars 4 and 5),0.8421252965927124
证券要闻,2025-08-28 08:10:40,华泰证券：农业“反内卷”初见成效 建议关注农牧龙头,界面新闻,华泰证券研报称，7月全国能繁母猪存栏环比转负、全国生猪出栏体重中枢持续下移，“反内卷”政策引导的生猪产能去化初见成效，华泰证券预计年内猪价或平稳运行、低成本公司仍有望实现较好盈利，中期猪价或值得观望；近期白鸡价格有所回暖，期待行业长期亏损可能带动的产能去化持续。,"http://finance.eastmoney.com/news/1353,202508283498509884.html",positive (stars 4 and 5),0.7925447225570679
证券要闻,2025-08-28 08:10:39,华泰证券：看好AI+AR眼镜产业链,界面新闻,华泰证券研报指出，今年MetaConnect大会将于9月17日—18日拉开帷幕。据MetaCTO透露，会上Meta有望发布带显示智能眼镜Celeste、第三代RayBan-Meta眼镜以及运动款Oakley眼镜，并可能展示全新的“元宇宙软件”，从硬件、交互、软件层面重新定义AI眼镜。,"http://finance.eastmoney.com/news/1353,202508283497198626.html",positive (stars 4 and 5),0.9430543780326843
证券要闻,2025-08-28 08:08:38,低轨卫星通信应用将开展商用试验 卫星互联网有望站上风口,财联社,【低轨卫星通信应用将开展商用试验 卫星互联网有望站上风口】工业和信息化部近日印发《关于优化业务准入促进卫星通信产业发展的指导意见》。意见提出，加快卫星互联网系统建设和应用服务，推动卫星互联网实现高质量发展，针对低轨卫星通信应用适时开展商用试验。,"http://finance.eastmoney.com/news/1353,202508283497198194.html",positive (stars 4 and 5),0.5905267000198364
证券要闻,2025-08-28 08:08:37,小米入股机器人核心部件研发商 机构看好产业链加速放量,财联社,【小米入股机器人核心部件研发商 机构看好产业链加速放量】近日，国华智能发生工商变更，新增北京小米智造股权投资基金合伙企业（有限合伙）为股东，同时，注册资本由约935.22万人民币增至约1047.45万人民币。公开信息显示，国华智能成立于2021年2月，是一家专注于智能制造产业上游机器人核心零部件研发与智能制造产业下游系统集成为一体的高科技企业。,"http://finance.eastmoney.com/news/1353,202508283497198075.html",positive (stars 4 and 5),0.7293280959129333
证券要闻,2025-08-28 08:04:05,华泰证券：头部企业重磅新品发布在即，看好AI+AR眼镜产业链,每日经济新闻,每经AI快讯，华泰证券指出，今年MetaConnect大会将于9月17日-18日拉开帷幕。据MetaCTO透露，会上Meta有望发布带显示智能眼镜Celeste、第三代RayBan-Meta眼镜以及运动款Oakley眼镜，并可能展示全新的“元宇宙软件”，从硬件、交互、软件层面重新定义AI眼镜。,"http://finance.eastmoney.com/news/1353,202508283497196865.html",positive (stars 4 and 5),0.8977043032646179
证券要闻,2025-08-28 08:04:05,中信建投：汽车板块不缺结构性行情 需重视半年报预期上修及估值修复行情,界面新闻,中信建投研报称，汽车行业开始进入半年报业绩密集披露期，前期预期相对低位的绩优汽零迎来估值上修行情，乘用车销量及盈利改善预期强化后也有强劲股价表现；此外，前期市场高关注度的机器人板块在近期密集催化下已创新高。中信建投认为，当前半年报季在市场宽流动性状况下，汽车板块不缺结构性行情，需重视半年报预期上修及估值修复行情，低估值的绩优价值及强产业趋势的科创成长优质个股具备alpha。,"http://finance.eastmoney.com/news/1353,202508283498510094.html",positive (stars 4 and 5),0.8107593655586243
证券要闻,2025-08-28 08:04:02,中信建投：AI PCB有望持续拉动PCB设备的更新和升级需求,界面新闻,中信建投研报称，AIPCB有望持续拉动PCB设备的更新和升级需求。PCB行业呈现重回上行期、产品高端化、东南亚建厂等特点，产量的增加及工艺的变化有望持续拉动PCB设备的更新和升级需求。钻孔、曝光、电镀、检测为PCB生产中的核心环节，直接决定了电路板的互联密度、信号完整性和生产良率。,"http://finance.eastmoney.com/news/1353,202508283498510258.html",positive (stars 4 and 5),0.9392774701118469
证券要闻,2025-08-28 08:04:02,中信建投：市场小盘成长更具弹性,界面新闻,中信建投指出，2023年12月后，由于市场暂时处于信心不足的状态，资金紧平衡，小盘股补跌，市场风格重新转向大盘和价值。2024年1月份以来，AI、智能车等热点反复活跃，带动市场风格向小盘和成长转变。2024年5月后，受地缘政治与宏观经济等因素影响，市场情绪进一步回落，成交额维持低位，市场风格转向大盘价值，大盘价值风格抗跌。,"http://finance.eastmoney.com/news/1353,202508283498510177.html",positive (stars 4 and 5),0.7354562282562256
证券要闻,2025-08-28 08:03:02,工信部印发《关于优化业务准入促进卫星通信产业发展的指导意见》，针对低轨卫星通信应用适时开展商用试验——《投资早参》,每日经济新闻,（一）重要市场新闻1、美股三大指数均小幅收涨，道指涨0.32%，标普500指数涨0.24%，纳指涨0.21%；大型科技股多数上涨，英特尔涨超2%，苹果、谷歌、微软、亚马逊小幅上涨；特斯拉、奈飞、Meta小幅下跌。,"http://finance.eastmoney.com/news/1353,202508283497197049.html",positive (stars 4 and 5),0.9267358183860779
证券要闻,2025-08-28 08:02:43,中国医药上半年净利润2.94亿元；治疗不孕不育长效注射液获批,21世纪经济报道,政策动向国务院：将中国（江苏）自由贸易试验区打造成为具有世界影响力的生物医药产业集聚地据商务部网站8月27日消息，近日，国务院印发《关于的批复》。《方案》提出7方面18项重点任务，开展全链条集成创新。,"http://finance.eastmoney.com/news/1353,202508283497196419.html",positive (stars 4 and 5),0.6892738938331604
证券要闻,2025-08-28 07:59:32,四大证券报精华摘要：8月28日,新华财经,新华财经北京8月28日电四大证券报内容精华摘要如下：中国证券报·A股成交额再超3万亿元QFII二季度加大配置力度8月27日，A股市场冲高回落，主要指数多数下跌，上证指数、深证成指均跌逾1%。成交额放量至3.20万亿元，创历史第二高，为连续11个交易日超2万亿元。行业板块普遍下跌，整个A股市场超4700只股票下跌。,"http://finance.eastmoney.com/news/1353,202508283497200431.html",positive (stars 4 and 5),0.7560924887657166
证券要闻,2025-08-28 07:59:22,华泰证券：农业“反内卷”初见成效 建议关注农牧龙头,人民财讯,【华泰证券：农业“反内卷”初见成效 建议关注农牧龙头】华泰证券研报称，7月全国能繁母猪存栏环比转负、全国生猪出栏体重中枢持续下移，“反内卷”政策引导的生猪产能去化初见成效，华泰证券预计年内猪价或平稳运行、低成本公司仍有望实现较好盈利，中期猪价或值得观望；近期白鸡价格有所回暖，期待行业长期亏损可能带动的产能去化持续。,"http://finance.eastmoney.com/news/1353,202508283497194637.html",positive (stars 4 and 5),0.7523030042648315
证券要闻,2025-08-28 07:58:32,投资日历：周四资本市场大事提醒,财联社,【投资日历：周四资本市场大事提醒】①今日共有1只新股申购，为北交所的巴兰仕（920112）。②商务部将于8月28日召开8月第2次例行新闻发布会。③2025中国国际大数据产业博览会（简称“数博会”）将于8月28日至30日在贵阳举办等。,"http://finance.eastmoney.com/news/1353,202508283497194461.html",positive (stars 4 and 5),0.8365710973739624
证券要闻,2025-08-28 07:56:44,卫星通信利好政策发布 6股获社保基金重仓,人民财讯,【卫星通信利好政策发布 6股获社保基金重仓】工信部日前印发《关于优化业务准入促进卫星通信产业发展的指导意见》。近年来，我国持续出台卫星通信相关政策，逐渐放开市场准入，推动行业发展。此外，近期卫星通信技术层面上利好消息不断。,"http://finance.eastmoney.com/news/1353,202508283497194116.html",positive (stars 4 and 5),0.6478436589241028
证券要闻,2025-08-28 07:56:41,中信建投：汽车板块不缺结构性行情 需重视半年报预期上修及估值修复行情,人民财讯,人民财讯8月28日电，中信建投研报称，汽车行业开始进入半年报业绩密集披露期，前期预期相对低位的绩优汽零迎来估值上修行情，乘用车销量及盈利改善预期强化后也有强劲股价表现；此外，前期市场高关注度的机器人板块在近期密集催化下已创新高。,"http://finance.eastmoney.com/news/1353,202508283497195247.html",positive (stars 4 and 5),0.8816007971763611
证券要闻,2025-08-28 07:56:38,中信建投：AI PCB有望持续拉动PCB设备的更新和升级需求,每日经济新闻,每经AI快讯，8月28日，中信建投研报称，AIPCB有望持续拉动PCB设备的更新和升级需求。PCB行业呈现重回上行期、产品高端化、东南亚建厂等特点，产量的增加及工艺的变化有望持续拉动PCB设备的更新和升级需求。钻孔、曝光、电镀、检测为PCB生产中的核心环节，直接决定了电路板的互联密度、信号完整性和生产良率。,"http://finance.eastmoney.com/news/1353,202508283497195189.html",positive (stars 4 and 5),0.9265374541282654
证券要闻,2025-08-28 07:56:04,新华财经早报：8月28日,新华财经,国家统计局：7月份规模以上工业生产保持稳定增长企业盈利水平持续恢复工业和信息化部：推动手机等终端设备直连卫星加快推广应用鼓励民营企业依法依规利用卫星资源上海：加快推进城中村改造工作支持银行业金融机构提供贷款探索发行企业债灵活就业和新就业形态劳动者权益保障座谈会27日在京召开，全国人大常委会副委员长王东明出席并讲话。,"http://finance.eastmoney.com/news/1353,202508283497194560.html",positive (stars 4 and 5),0.5999357104301453
证券要闻,2025-08-28 07:56:04,华泰证券：Meta新品即将亮相 看好AI+AR眼镜产业链,人民财讯,【华泰证券：Meta新品即将亮相 看好AI+AR眼镜产业链】华泰证券研报指出，今年Meta Connect大会将于9月17日—18日拉开帷幕。据Meta CTO透露，会上Meta有望发布带显示智能眼镜Celeste、第三代RayBan-Meta眼镜以及运动款Oakley眼镜，并可能展示全新的“元宇宙软件”，从硬件、交互、软件层面重新定义AI眼镜。华泰证券持续看好在AI模型能力提升的背景下，眼镜这一产品形态作为Always-on交互入口所具备的长期潜力；同时建议关注近期头部企业新品发布对产业链带来的短期催化。,"http://finance.eastmoney.com/news/1353,202508283497191713.html",positive (stars 4 and 5),0.8951424360275269
证券要闻,2025-08-28 07:55:28,数据中心销售额不及预期，英伟达盘后跌超3%；OpenAI重组因与微软的谈判而推迟丨全球科技早参,每日经济新闻,NO.1数据中心销售额不及预期，英伟达盘后跌超3%当地时间8月27日，英伟达在盘后公布了第二季度收益报告，其营收和净利润均超出预期，但其数据中心收入略低于分析师预期，这给盘后交易中的股价造成了压力。受此消息影响，英伟达股价盘后下跌3.08%。点评：英伟达最新财报显示，其第二季度营收与净利润均超预期，但数据中心收入略低于分析师预估，引发市场对其AI增长动能的担忧。,"http://finance.eastmoney.com/news/1354,202508283497193922.html",positive (stars 4 and 5),0.641579270362854
证券要闻,2025-08-28 07:53:13,聚焦出行上市公司中报：曹操出行递交上市后首份“成绩单” 企业竞相加大押注Robotaxi力度,科创板日报,《科创板日报》8月28日讯（记者李煜实习记者戴嘉怡）近日，多家出行上市公司纷纷披露中期业绩公告。其中，于今年6月在港交所主板挂牌上市的曹操出行，递交了上市后的首份“成绩单”。从目前已披露的国内出行上市公司2025年中期业绩来看，多数企业释放出业绩向好的信号。,"http://finance.eastmoney.com/news/1353,202508283497174123.html",positive (stars 4 and 5),0.7979825735092163
证券要闻,2025-08-28 07:51:19,中信建投：AI PCB有望持续拉动PCB设备的更新和升级需求,人民财讯,【中信建投：AI PCB有望持续拉动PCB设备的更新和升级需求】中信建投研报称，AI PCB有望持续拉动PCB设备的更新和升级需求。PCB行业呈现重回上行期、产品高端化、东南亚建厂等特点，产量的增加及工艺的变化有望持续拉动PCB设备的更新和升级需求。钻孔、曝光、电镀、检测为PCB生产中的核心环节，直接决定了电路板的互联密度、信号完整性和生产良率。,"http://finance.eastmoney.com/news/1353,202508283497159013.html",positive (stars 4 and 5),0.9147458076477051
证券要闻,2025-08-28 07:50:37,早新闻｜商务部最新发声,数据宝,宏观热点工业和信息化部：促进卫星通信、5G/6G、人工智能等新一代信息通信技术深度互融据工业和信息化部8月27日消息，工业和信息化部近日印发《关于优化业务准入促进卫星通信产业发展的指导意见》（下称《指导意见》）。《指导意见》提出，加快关键核心技术攻关。,"http://finance.eastmoney.com/news/1353,202508283497192285.html",positive (stars 4 and 5),0.6889044642448425
证券要闻,2025-08-28 07:50:15,卫星通信产业重磅政策发布；英伟达2026财年Q2营收467亿美元｜早新闻,21世纪经济报道,今日关注1、中国人民抗日战争暨世界反法西斯战争胜利80周年纪念活动新闻中心发布通知，将举办3场记者招待会、3场记者见面会。今天（28日）上午10时，将举办第一场记者招待会，介绍活动有关筹备进展。2、今天（28日）10时，全运会首批门票开售。宏观经济1、2025年服贸会将于9月10日至14日举办，目前各项筹备工作已基本就绪。,"http://finance.eastmoney.com/news/1354,202508283497193139.html",positive (stars 4 and 5),0.6932052969932556
证券要闻,2025-08-28 07:50:14,603303，重大资产重组！这个赛道大利好，6股获社保基金重仓,数据宝,得邦照明拟收购嘉利股份不少于51%股份。8月27日晚间，得邦照明（603303）发布公告，公司拟以现金方式通过受让股份及增资的方式，取得嘉利股份不少于51%股份并取得目标公司的控制权。具体交易方式、交易对方、收购比例待进一步论证和协商。本次交易完成后，目标公司将成为公司控股子公司。,"http://finance.eastmoney.com/news/1354,202508283497182874.html",positive (stars 4 and 5),0.6724308133125305
证券要闻,2025-08-28 07:50:00,A股股票回购一览：今日27家公司披露回购进展,每日经济新闻,每经AI快讯，Wind数据显示，8月28日，27家公司共发布28个股票回购相关进展。其中，18家公司首次披露股票回购预案，1家公司回购方案获股东大会通过，2家公司披露股票回购实施进展，6家公司回购方案已实施完毕。从首次披露回购预案来看，北京科锐、海目星、海科新源回购预案金额最高，分别拟回购不超1.0亿元、3600.0万元、2200.0万元。,"http://finance.eastmoney.com/news/1353,202508283497175364.html",positive (stars 4 and 5),0.789547860622406
