栏目,发布时间,标题,来源媒体,摘要,URL,情感,置信度
证券要闻,2025-08-28 23:59:01,每天三分钟公告很轻松 | 300972 净利增长50358.8%,上海证券报,万辰集团等公司上半年净利增长逾10倍；寒武纪：预计2025年全年实现营业收入50亿元至70亿元；中环海陆：筹划公司控制权变更事项29日起停牌；芯原股份：筹划购买芯来智融股权29日起停牌；冰川网络和华胜天成业绩扭亏……今日看点▼聚焦一：万辰集团等公司上半年净利增长逾10倍万辰集团（300972）：披露半年报。,"http://finance.eastmoney.com/news/1354,202508283498425769.html",positive (stars 4 and 5),0.7063571214675903
证券要闻,2025-08-28 23:52:01,英伟达股价急跌，中概股、黄金拉升，人民币创9个多月新高,21世纪经济报道,北京时间8月28日晚，美股三大指数小幅高开后一度跳水，截至23:40，纳指、标普500指数翻红，道指仍有所下跌。多只绩优中概股上涨截至23:00左右，纳斯达克中国金龙指数涨约0.2%，爱奇艺、老虎证券、世纪互联涨幅居前，其中多家公司业绩报喜，如老虎证券二季度营收同比增长58.7%，创历史新高；世纪互联二季度营收同比增长22.1%。,"http://finance.eastmoney.com/news/1354,202508283498420187.html",positive (stars 4 and 5),0.7675924301147461
证券要闻,2025-08-28 23:34:19,上半年部分券商资管成绩单出炉 有机构规模增长23% 部分券商规模与利润“倒挂”,财联社,财联社8月28日讯（研究员王蔚）随着部分上市券商披露2025年半年报，券商资管业务的最新情况浮出水面。截至发稿日，共有18家上市券商公布半年报，不同机构间的资产管理规模与经营业绩呈现出明显的分化态势。券商资管产品总体来说有四种，分别为单一资管计划、集合资管计划、专项资管计划和公募基金。,"http://finance.eastmoney.com/news/1353,202508283498413230.html",positive (stars 4 and 5),0.8752543330192566
证券要闻,2025-08-28 23:33:59,银行半年报密集披露 理财业务表现不一 部分存续规模涨幅达17%,财联社,财联社8月28日讯（研究员李响）今日，浦发银行、杭州银行、中信银行等多家上市银行集中披露了半年度报告。半年报数据显示，受宏观经济环境、监管政策调整及市场竞争加剧等多重因素影响，银行理财业务呈现明显分化态势，拥有理财子公司的机构普遍实现规模增长，而部分未设立理财子公司的区域性银行则面临规模收缩压力。,"http://finance.eastmoney.com/news/1354,202508283498413086.html",positive (stars 4 and 5),0.866988480091095
证券要闻,2025-08-28 23:29:38,8月28日晚间重要公告集锦,上海证券报·中国证券网,冰川网络：上半年净利3.36亿元拟10派10元上证报中国证券网讯（记者骆民）冰川网络披露半年报。公司2025年上半年实现营业收入12.57亿元，同比增长4.21%；实现归属于上市公司股东的净利润3.36亿元，上年同期亏损5.15亿元；基本每股收益1.43元/股。公司2025年半年度利润分配预案为：向全体股东每10股派发现金红利10元（含税）。,"http://finance.eastmoney.com/news/1354,202508283498413182.html",positive (stars 4 and 5),0.7523121237754822
证券要闻,2025-08-28 23:28:37,多家银行宣布：下调存款利率！,每日经济新闻,据央视财经，近期，多家中小银行宣布下调人民币存款利率，降幅达10到20个基点。其中，江苏银行、南京银行等多家银行宣布调整3年期定期存款利率。南京银行北京某支行工作人员：上周五，三年期存款利率1.85%调成1.75%了。江苏银行北京某支行工作人员：三年期存款利率1.75%，之前三年期存款利率是1.85%，是上周三降的。,"http://finance.eastmoney.com/news/1354,202508283498411821.html","negative (stars 1, 2 and 3)",0.568645179271698
证券要闻,2025-08-28 23:28:19,5家亏损，2家净利下滑！新三板保险中介陷窘境,国际金融报,新三板保险中介业绩滑坡。据《国际金融报》记者统计，截至8月28日，共有8家新三板挂牌保险中介披露了2025年上半年的业绩数据，其中5家出现亏损，2家净利润同比下滑。事实上，我国保险中介市场虽然主体数量多、发展速度快，但整体发展模式较为粗放，竞争能力不强。,"http://finance.eastmoney.com/news/1354,202508283498411417.html",positive (stars 4 and 5),0.6072859168052673
证券要闻,2025-08-28 23:22:52,A股并购“芯”风暴：聚焦光刻机与GPU 谁欲“蛇吞象”谁又“玩飞了”,财联社,8月28日，主营业务为包装印刷的永吉股份（603058.SH）在停牌半个月后复牌，其股价在开盘后下跌10.02%。前一晚，公司公告终止对芯片公司南京特纳飞电子技术有限公司的收购。据过往公告，特纳飞是一家专注于数据存储主控芯片研发的企业，跟永吉股份的主营业务属于“八竿子打不着”的关系。,"http://finance.eastmoney.com/news/1354,202508283498407580.html",positive (stars 4 and 5),0.5022751092910767
证券要闻,2025-08-28 23:18:34,特朗普、鲍威尔 被起诉！,证券时报,美股三大指数小幅高开，道琼斯指数涨0.10%，标普500指数涨0.10%，纳斯达克综合指数涨0.27%。英伟达（Nvidia）股价由涨转跌。截至发稿，英伟达下跌近1%。英伟达2026财年第二季度财报显示，公司该季度营收持续增长，总营收达467亿美元，较去年同期增长56%。这一增长主要由人工智能（AI）主导的数据中心业务推动，该业务营收同比增幅同样达到56%，至411亿美元。,"http://finance.eastmoney.com/news/1354,202508283498406628.html",positive (stars 4 and 5),0.8813827633857727
证券要闻,2025-08-28 23:11:31,多路径出海 家居企业从“代工”向“品牌”转型,北京商报,8月28日，北京商报记者梳理多家家居企业半年报注意到，顾家家居、索菲亚、慕思股份、坚朗五金、好莱客在内等企业境外营收均实现不同程度增长。事实上，随着国内家居产业升级与全球消费需求回暖，国内家居品牌正在加速出海。,"http://finance.eastmoney.com/news/1354,202508283498404590.html",positive (stars 4 and 5),0.7630056738853455
证券要闻,2025-08-28 23:02:31,中国科技产业重塑资本市场：寒武纪超越茅台100多元，坐实A股新王,上观新闻,如果说寒武纪股价在8月27日对茅台的超越太过短暂，那么8月28日的再次超越就实至名归了。当日，寒武纪股价一路高涨，收盘报1587.91元/股，强势超越茅台收盘价1446.10元/股，坐稳A股新股王之位。寒武纪本轮股价大涨始于7月10日，从低点520.67元涨至8月28日的1587.91元，仅用了一个多月。如果按寒武纪的发行价64.39元计算，其在上市5年来已暴涨了20倍。,"http://finance.eastmoney.com/news/1354,202508283498402214.html",positive (stars 4 and 5),0.8414961695671082
证券要闻,2025-08-28 22:59:03,第三个3万亿！A股V型反弹 下一步如何布局？,国际金融报,8月28日，A股高开，上午窄幅震荡，午后一度跳水，但不久后拉升，走出V型行情。截至收盘，三大指数大涨。虽然仅2868只个股收涨，但市场交投氛围活跃，单日成交额本周内第三次突破3万亿元。受访人士表示，牛市常有急跌现象。展望后市，市场大概率延续震荡格局，但结构性行情依然值得期待。投资者可继续聚焦科技等核心板块，不过需注意把握交易节奏，密切关注量能变化及板块轮动节奏。,"http://finance.eastmoney.com/news/1353,202508283498511148.html",positive (stars 4 and 5),0.9115055799484253
证券要闻,2025-08-28 22:57:52,重庆A股34家上涨 国际复材、*ST惠程涨停,上游新闻,8月28日，78家重庆A股上市公司中有34家上涨。数据显示，国际复材以上涨19.97%（涨停）位居第一，旺成科技以上涨8.35%列涨幅第二，再升科技以上涨5.88%列涨幅第三，*ST惠程以上涨5.05%（涨停）列涨幅第六。国际复材以19.97%涨幅列第一国际复材报收7.87元，日涨幅19.97%（涨停），换手率20.66%，今年以来的涨幅112.70%。,"http://finance.eastmoney.com/news/1354,202508283498400193.html",positive (stars 4 and 5),0.891929566860199
证券要闻,2025-08-28 22:57:33,寒武纪股价超越茅台后 将给市场带来怎样的变局,上游新闻,周四（8月28日）A股上演精彩大逆转，科创板再度断层式领涨。值得一提的是，周三盘中7分钟股价反超贵州茅台的“寒武纪”，周四更是一路狂飙。具体来看：当天贵州茅台冲高回落报收于1446.10元，而寒武纪股价飙涨15.73%报收于1587.91元，超越幅度高达10%！同时，寒武纪的总市值也达到了6643.02亿元，断层式领衔科创板其他个股。,"http://finance.eastmoney.com/news/1354,202508283498398546.html",positive (stars 4 and 5),0.7008647918701172
证券要闻,2025-08-28 22:56:23,寒武纪登顶“股王” A股投资逻辑生变？,21世纪经济报道,近期市场突破3800点之后出现了震荡调整，A股市场资金也出现分歧。8月28日，A股上演V型反转。在科技股拉升带动下，中芯国际、寒武纪创新高，科创50指数大涨逾7%，同样创出新高。而贵州茅台、宁德时代当日收跌。近期资金从茅王、宁王撤退，转向中芯国际、寒武纪等为代表的新兴科技企业。,"http://finance.eastmoney.com/news/1354,202508283498399815.html",positive (stars 4 and 5),0.7508821487426758
证券要闻,2025-08-28 18:51:07,事关城市高质量发展 中央重磅文件对外公布,新华社,【中共中央 国务院发布关于推动城市高质量发展的意见】主要目标是：到2030年，现代化人民城市建设取得重要进展，适应城市高质量发展的政策制度不断完善，新旧动能加快转换，人居品质明显提升，绿色转型深入推进，安全基础有力夯实，文化魅力充分彰显，治理水平大幅提高；到2035年，现代化人民城市基本建成。,"http://finance.eastmoney.com/news/1345,202508283498107349.html",positive (stars 4 and 5),0.6594929695129395
证券要闻,2025-08-28 22:43:08,【中证十点半】寒武纪预计2025年营收50亿元至70亿元；万辰集团上半年净利润大增50359%,中国证券报·中证金牛座,【中证十点半】寒武纪预计2025年营收50亿元至70亿元；万辰集团上半年净利润大增50359%,"http://finance.eastmoney.com/news/1354,202508283498391650.html",positive (stars 4 and 5),0.8694220185279846
证券要闻,2025-08-28 22:41:16,芯原股份筹划购买芯来智融股权；“寒王”预计今年营收50亿元至70亿元丨公告精选,21世纪经济报道,今日焦点芯原股份：筹划购买芯来智融股权股票停牌芯原股份公告称，公司正在筹划以发行股份及支付现金的方式购买芯来智融半导体科技（上海）有限公司股权并募集配套资金。由于本次交易尚处于筹划阶段，且标的公司审计评估、交易金额、发行股份及支付现金比例等内容暂未确定，因此无法确定是否构成重大资产重组及关联交易。公司股票自2025年8月29日开市起开始停牌，预计停牌时间不超过10个交易日。,"http://finance.eastmoney.com/news/1354,202508283498390072.html",positive (stars 4 and 5),0.6348675489425659
证券要闻,2025-08-28 22:35:09,南都电商观察｜4人直播间组织刷人气被判刑；京东进军团播,南方都市报,主播&达人1、全红婵哥哥回应AI仿声带货近日，全红婵的哥哥全进华在直播中回应“妹妹被AI仿冒声音卖土鸡蛋”一事，气愤表示：“我妹妹在训练基地她怎么卖鸡蛋？那是AI声音，全平台一大堆这样的切片，我现在告都告不过来，一个一个都在告。”全进华表示：“我懂你们想要支持的内心，但你们要看清楚，我妹妹是在役运动员，不能去做直播卖货，大家注意甄别，新闻里已经曝光过AI克隆声音乱象。,"http://finance.eastmoney.com/news/1354,202508283498385387.html","negative (stars 1, 2 and 3)",0.6943578720092773
证券要闻,2025-08-28 22:33:00,美联储降息预期升温 对哪些资产影响大？专访星展中国周邦贵：香港利率相关产品吸引力将下降,财联社,财联社8月28日讯（记者郭子硕）近日多家机构预计，美联储很可能于9月降息，降息幅度约25个基点。美联储降息预期快速攀升，在全球金融市场掀起波澜，也促使国内投资者加速调整资产配置策略。在此背景下，财联社就降息周期下资产配置方向、外资行财富管理业务应对之策等问题，对星展中国个人银行及财富管理业务总经理周邦贵进行了专访。,"http://finance.eastmoney.com/news/1353,202508283498414392.html",positive (stars 4 and 5),0.7527202367782593
证券要闻,2025-08-28 22:25:33,48座万达广场出售初步落地 万达与腾讯京东成立合伙企业,中国经营报,自今年5月底出售48座自持万达广场的消息披露之后，近日，万达集团出售资产事宜有了新动向。公开信息显示，由腾讯、京东、万达等13位合伙人共同出资的私募基金已于近日成立，出资额高达224.29亿元，预计此次收购将通过专项基金平台完成。与此同时，万达集团分别与腾讯、京东成立合伙企业，出资额分别为160.8亿元、80.5亿元。万达集团近年来出售资产、引入战投动作不断。,"http://finance.eastmoney.com/news/1354,202508283498382998.html",positive (stars 4 and 5),0.6579984426498413
证券要闻,2025-08-28 22:23:10,期货业又一次高层“大换血”,国际金融报,期货业又迎来一轮高层“换血”。8月26日，中国期货业协会发布新一期期货公司高管人员专业能力水平评价测试合格人员名单。记者注意到，此次期货公司高管专业能力测试合格名单共涉及20家期货公司以及25名高管人员。4家拟更换董事长从董事层名单来看，共计11家期货公司出现变动。,"http://finance.eastmoney.com/news/1353,202508283498511453.html",positive (stars 4 and 5),0.611918568611145
证券要闻,2025-08-28 22:12:09,国泰海通证券：随着固态电池市场需求逐渐兴起，前瞻布局硫化锂的企业有望受益,人民财讯,人民财讯8月28日电，国泰海通证券认为硫化物固态电解质凭借更优秀的综合性能有望成为全固态电池的主流选择，其中硫化锂是硫化物固态电解质的核心原材料，潜在的市场空间广阔，吸引了众多企业布局。硫化锂主流制备路线可分为三大类，固相法、液相法、气相法。随着固态电池市场需求逐渐兴起，前瞻布局硫化锂的企业有望受益。,"http://finance.eastmoney.com/news/1353,202508283498420939.html",positive (stars 4 and 5),0.9393547773361206
证券要闻,2025-08-28 22:10:37,最高抢筹超12亿元，外资盯上这些股！最新筹码连续集中股来了,数据宝,今日（8月28日），A股三大指数止跌回升，集体收涨，A股全天成交额约3万亿元，较前一交易日缩量超1900亿元。收盘上涨个股超2800只，其中收盘股价涨停的有66只。盘面上，共封装光学、光刻机等概念上涨；转基因、重组蛋白等概念跌幅居前。109股收盘价创历史新高据证券时报·数据宝统计，不含近一年上市的次新股，今日共有109股收盘价创历史新高。,"http://finance.eastmoney.com/news/1354,202508283498376455.html",positive (stars 4 and 5),0.9072169661521912
证券要闻,2025-08-28 22:10:09,对话联合国首席信息技术官：DeepSeek是“伟大的进化”,21世纪经济报道,21世纪经济报道记者吴斌上海报道近期，国产大模型厂商DeepSeek推出V3.1版本，主要有三大亮点，包括混合推理架构、更高的思考效率以及更强的智能体能力。联合国助理秘书长、首席信息技术官BernardoMarianoJunior告诉21世纪经济报道记者，自从DeepSeek发布以来，他就一直在使用。,"http://finance.eastmoney.com/news/1353,202508283498464597.html",positive (stars 4 and 5),0.965771496295929
证券要闻,2025-08-28 22:04:28,国泰海通证券：持续的政策支持AI应用落地 国内AI产业发展有望进一步加速,人民财讯,【国泰海通证券：持续的政策支持AI应用落地 国内AI产业发展有望进一步加速】国泰海通证券研究指出，人工智能是新一轮科技革命和产业变革的重要驱动力量。国内AI产业的发展有望进一步加速，看好从AI基础设施到AI大模型到AI应用的发展闭环，维持计算机行业“增持”评级。,"http://finance.eastmoney.com/news/1353,202508283498343686.html",positive (stars 4 and 5),0.7973412275314331
证券要闻,2025-08-28 22:01:31,人工智能应用带动云数据库需求激增,新华财经,新华财经上海8月28日电（记者王淑娟）生成式人工智能应用需处理海量非结构化数据，带动了市场对云数据库的需求激增。,"http://finance.eastmoney.com/news/1354,202508283498364612.html",positive (stars 4 and 5),0.9594888091087341
证券要闻,2025-08-28 20:01:10,寒武纪紧急回应！预计2025年全年实现营业收入50亿元至70亿元,证券时报,【寒武纪：预计2025年全年实现营业收入50亿元至70亿元】8月28日，寒武纪发布股票交易风险提示公告，公司关注到近期市场上存在部分对公司经营情况的预测，公司结合实际情况，预计2025年全年实现营业收入50亿元至70亿元。,"http://finance.eastmoney.com/news/1345,202508283498198522.html",positive (stars 4 and 5),0.7777754664421082
证券要闻,2025-08-28 22:00:26,8月多家银行首席合规官亮相！业内：行业合规将呈现制度化、智能化与全员化趋势,每日经济新闻,8月，已有多位银行首席合规官亮相！8月26日，国家金融监督管理总局山东监管局官网发布一则批复，核准刘强济宁银行首席合规官的任职资格。除了济宁银行，也有上市银行发布首席合规官相关消息。如江苏银行发布董事会决议公告，审议通过关于聘任袁军为公司首席合规官的议案。紫金银行也发布公告称，聘任阙正和为首席合规官。值得注意的是，两位上市银行的首席合规官都有另一个身份——所在行行长。,"http://finance.eastmoney.com/news/1354,202508283498365044.html",positive (stars 4 and 5),0.7807474732398987
证券要闻,2025-08-28 21:57:18,2025中国民营企业500强揭晓，北京上榜企业“科技含量”高,新京报,8月28日，2025中国民营企业500强榜单发布。榜单显示，我国民营企业在复杂多变的国内外环境中，展现出了强劲的韧性与活力。中国人民大学国家发展与战略研究院研究员、国家中小企业研究院副院长孙文凯教授对新京报贝壳财经记者表示，整体上看，2025中国民营企业500强呈现出不断优化的特点。从榜单上看，大多数500强企业实现营收增长，经营状况整体向好。,"http://finance.eastmoney.com/news/1354,202508283498360871.html",positive (stars 4 and 5),0.9377251863479614
证券要闻,2025-08-28 21:54:39,【西街观察】外卖“烧钱”没有赢家,北京商报,血脉偾张的竞争，最终反馈到“血淋淋”的财务报表上。京东、美团相继披露二季度财报，美团经调整净利润为14.9亿元，同比下滑89%；京东归属股东净利润62亿元，同比下滑50.8%。巨额补贴为主要特征的外卖大战，给企业带来数十亿乃至百亿级别的利润下滑，业内早有预料，答案揭晓依然触目惊心。有些成本支出契合产业生态，比如骑手社保权益、商家佣金减免。,"http://finance.eastmoney.com/news/1354,202508283498358456.html",positive (stars 4 and 5),0.9048857688903809
证券要闻,2025-08-28 21:52:43,芯原股份筹划购买芯来智融股权；中芯国际上半年净利润同比增长近40%｜公告精选,每日经济新闻,并购重组北新建材：公司意向收购境外一家建筑材料公司100%股权北新建材公告，公司意向收购境外一家建筑材料公司100%股权（以下简称标的公司）并在董事会授权范围内进行约束性报价。标的公司业务与公司主营业务属于相同领域，与公司存在协同效应，收购该标的公司股权对公司未来发展具有积极影响。,"http://finance.eastmoney.com/news/1354,202508283498355627.html",positive (stars 4 and 5),0.8273680806159973
证券要闻,2025-08-28 15:12:54,A股午后大反攻 科创50指数涨超7%！发生了什么？,券商中国,【A股午后大反攻！发生了什么？】从目前的市场来看，仍是结构牛。上涨的部分主要集中在科技白马股。这一点也可以从ETF中看得出来，很多新进来的投资者也基本上是以买入ETF为主。,"http://finance.eastmoney.com/news/1344,202508283497913264.html",positive (stars 4 and 5),0.7865793108940125
证券要闻,2025-08-28 21:51:10,美股三大指数小幅高开，热门中概股涨跌互现,第一财经,21:33美股开盘丨三大指数小幅高开道指涨0.06%，纳指涨0.15%，标普500指数涨0.04%。Snowflake涨超11%，公司Q2业绩超市场预期。英伟达涨超1%。中概股涨跌互现，阿里巴巴、京东跌超2%，蔚来、理想汽车涨超2%。21:08美股三大股指期货小幅走高，截至发稿，道指期货涨0.13%，标普500指数期货涨0.05%，纳指期货涨0.03%。,"http://finance.eastmoney.com/news/1354,202508283498355289.html",positive (stars 4 and 5),0.7510554790496826
证券要闻,2025-08-28 21:48:37,“00后”跑步进股市，佣金杀到“万1”！新一轮开户潮来了,国际金融报,8月底，A股连创新高，一周两度成交近3.2万亿元，亢奋与获利回吐交织。《国际金融报》记者从券商处获悉，量价齐升带动新开户、杠杆资金激增，两融余额升至2.2万亿元，占流通市值2.26%。业内人士提醒称，杠杆放大波动，投资者务必警惕急跌风险。,"http://finance.eastmoney.com/news/1353,202508283498352258.html",positive (stars 4 and 5),0.7828382253646851
证券要闻,2025-08-28 21:46:43,21评论｜国产算力需要耐心资本和长期生态构建,21世纪经济报道,特约评论员陈白近期，有“国产AI芯片第一股”之称的寒武纪，在沉寂许久后股价一度飙涨，市值一度超6000亿元，超越茅台成为新任“股王”。寒武纪的爆发与国产算力领域正在发生的巨大变化有直接关系。这一轮异动的背后，并非简单的概念炒作，而是与近期密集出台的政策信号和产业动向形成了强烈的共振。,"http://finance.eastmoney.com/news/1354,202508283498351820.html",positive (stars 4 and 5),0.896734893321991
证券要闻,2025-08-28 21:43:13,增值超800%！这家券商拟卖上海、深圳等地6处房产，估值超2.6亿,中国基金报,【导读】红塔证券拟出售6处房产，评估价值为2.628亿元8月28日晚间，红塔证券发布公告称，为盘活内部闲置资产，公司拟通过在产权交易中心挂牌转让方式处置公司所拥有的6处房屋。根据评估机构出具的报告，红塔证券拟处置的6项房产于评估基准日2025年4月30日账面净值为2912.89万元，评估价值为2.628亿元（含增值税），增值率为802.17%。,"http://finance.eastmoney.com/news/1354,202508283498349317.html",positive (stars 4 and 5),0.8375887274742126
证券要闻,2025-08-28 21:42:42,美股三大指数小幅高开 蔚来涨近3%,人民财讯,人民财讯8月28日电，美股三大指数小幅高开，道指涨0.10%，标普500指数涨0.10%，纳指涨0.27%，英特尔涨0.44%，Meta跌0.45%。纳斯达克中国金龙指数跌0.13%，蔚来涨2.92%，小鹏汽车跌2.36%。,"http://finance.eastmoney.com/news/1354,202508283498348750.html",positive (stars 4 and 5),0.8434963226318359
证券要闻,2025-08-28 21:40:25,美股三大指数小幅高开,界面新闻,美股三大指数小幅高开，道琼斯指数涨0.10%，标普500指数涨0.10%，纳斯达克综合指数涨0.27%。英伟达涨1%，公司Q2营收、净利均超预期，但数据中心业务营收不及预期。,"http://finance.eastmoney.com/news/1353,202508283498469532.html",positive (stars 4 and 5),0.7646152377128601
证券要闻,2025-08-28 21:35:27,海外机构调研股名单 天孚通信最受关注,证券时报网,根据调研日期截止日统计，近10日（8月15日至8月28日），海外机构对201家上市公司进行调研，其中，天孚通信最受关注，被59家海外机构密集调研。证券时报·数据宝统计显示，近10日共有496家公司获机构调研，调研机构类型显示，证券公司调研达482家，占比最多；基金公司调研425家，位列其后；海外机构共对201家上市公司进行走访。,"http://finance.eastmoney.com/news/1354,202508283498331964.html",positive (stars 4 and 5),0.8435571193695068
证券要闻,2025-08-28 21:35:14,44.22亿主力资金净流入，6G概念涨4.26%,证券时报网,截至8月28日收盘，6G概念上涨4.26%，位居概念板块涨幅第7，板块内，66股上涨，三维通信、沃格光电、崇达技术等涨停，东田微、明阳电路、创远信科等涨幅居前，分别上涨15.38%、8.77%、8.68%。跌幅居前的有七一二、直真科技、慈星股份等，分别下跌3.06%、1.56%、1.14%。,"http://finance.eastmoney.com/news/1353,202508283498330861.html",positive (stars 4 and 5),0.7098813056945801
