栏目,发布时间,标题,来源媒体,摘要,URL,情感,置信度
证券要闻,2025-08-28 18:54:10,外交部：30个欧洲国家近50位领导人、前政要等确认出席中方纪念活动,央视新闻,8月28日，外交部发言人郭嘉昆主持例行记者会。有记者提问，下周中方将举行纪念中国人民抗日战争暨世界反法西斯战争胜利80周年活动，国际社会对此高度关注。一些欧洲国家将有领导人或派高级别代表出席，但也有舆论称可能有些国家因为种种原因不愿出席。中方对此有何评论？郭嘉昆表示，今年是中国人民抗日战争暨世界反法西斯战争胜利80周年，中方将隆重举行纪念活动。,"http://finance.eastmoney.com/news/1345,202508283498110182.html",positive (stars 4 and 5),0.7584730982780457
证券要闻,2025-08-28 17:22:57,42万人待抢迷你版Labubu 79元隐藏款炒至1100元,21世纪经济报道,泡泡玛特官宣“迷你版Labubu”（THEMONSTERS心底密码系列）将于今日22时线上开售，明日线下开售。21财经·南财快讯记者注意到，尽管迷你版Labubu还未正式发售，但二手平台的“预售单”已先一步火热，延续了Labubu加价抢购热。迷你版Labubu分为A/B两端，各含14个常规款，1个隐藏款，常规款概率为1:14，隐藏款概率为1:168。,"http://finance.eastmoney.com/news/1354,202508283498042446.html",positive (stars 4 and 5),0.9681137800216675
证券要闻,2025-08-28 13:44:17,601869，3分钟，垂直涨停！4天3板！,证券时报网,今日早盘，A股小幅震荡上扬，科技股继续领涨，科创50指数盘中一度大涨逾5%，再创3年半来新高，创业板指、深证成指、沪深300等也均小幅飘红，市场成交保持平稳。盘面上，通信设备、芯片、玻璃玻纤、航天装备等板块涨幅居前，农林牧渔、地面兵装、环保设备、教育培训等板块跌幅居前。,"http://finance.eastmoney.com/news/1353,202508283497848017.html",positive (stars 4 and 5),0.9318073987960815
证券要闻,2025-08-28 08:41:33,“茅台魔咒”又应验？政策、机构与游资能否合力再次助推“寒王”登顶？,财联社,【“茅台魔咒”又应验？政策、机构与游资能否合力再次助推“寒王”登顶？】A股历史上，包括中国船舶、全通教育、长春高新等不少个股挑战过贵州茅台“股王”位置，中国移动也曾短暂超越过茅台股价，但最终都未能撼动茅台的地位。茅台魔咒再次应验，作为科技先锋的代表，市场依然期待“寒王”对贵州茅台发起下一次挑战。,"http://finance.eastmoney.com/news/1354,202508283497205358.html",positive (stars 4 and 5),0.8618073463439941
证券要闻,2025-08-28 18:52:46,首次！空军将向公众静态展示歼-20,财联社,据国防部发布，8月28日下午，国防部举行例行记者会，国防部新闻发言人张晓刚大校答记者问。记者：据报道，9月19日至23日，空军将在长春举办航空开放活动。请发言人介绍有关情况。,"http://finance.eastmoney.com/news/1345,202508283498109612.html",positive (stars 4 and 5),0.6550955176353455
证券要闻,2025-08-28 13:27:41,机构：价格竞争加剧 燃油车新车质量承压,新华财经,新华财经上海8月28日电（记者王鹤）市场研究机构J.D.Power君迪28日发布2025中国新车质量研究SM（IQS），该新车质量研究以平均每百辆车问题数（PP100）表达，分值越低，表明问题数越少，质量越好。数据显示：2025年，国内燃油车整体新车质量的每百辆车问题数为229个PP100，较2024年上升了17个PP100，新车整体质量水平下滑。,"http://finance.eastmoney.com/news/1353,202508283498442096.html",positive (stars 4 and 5),0.9251247048377991
证券要闻,2025-08-28 18:46:37,万亿险资A股重仓图谱：高股息资产“压舱”,21世纪经济报道,作为“投资长钱”的“课代表”，险资动向向来是市场关注的风向标。当前A股上市公司陆续披露2025年中报，险资二季度的重仓股和调仓换股情况陆续出炉。根据数据显示，截至8月27日，共有368只个股被险资重仓持有，主要聚焦于非银金融、银行、通信、电力设备、有色金属、公用事业等板块。当前，险资提升高股息标的配置既可获取稳定分红，又能缓冲债券收益率下行带来的影响。,"http://finance.eastmoney.com/news/1345,202508283498105986.html",positive (stars 4 and 5),0.935050368309021
证券要闻,2025-08-28 12:22:01,A股两大信号突然闪现！中芯国际和寒武纪皆创历史新高！,券商中国,【A股两大信号突然闪现！中芯国际和寒武纪皆创历史新高！】分析人士认为，从产业发展的逻辑来看，人工智能无疑是未来的主线，而这个板块的重点公司主要集中科创板，因此受到资金热捧也在意料之中。不过，市场也出现了两大信号：一是多头格局萎缩，二是需警惕交易结构恶化。从一些指标来看，市场的确存在局部过热的情况，波动风险需关注。,"http://finance.eastmoney.com/news/1344,202508283497714826.html",positive (stars 4 and 5),0.8747210502624512
证券要闻,2025-08-28 13:11:48,603058，“一字”跌停，跨界芯片失败！QFII最新持股出炉，新进重仓33股,数据宝,QFII二季度末最新持仓市值超610亿元。8月28日早盘，A股主要指数冲高回落，临近午盘，三大指数出现跳水走势。截至午间收盘，沪指涨0.07%，深成指涨0.56%，创业板指涨1.26%，市场成交额1.79万亿元。盘面上，科技股仍领涨市场，CPO、卫星互联网、6G等概念涨幅居前，教育、医药生物、房地产、电力等行业跌幅靠前。,"http://finance.eastmoney.com/news/1353,202508283497764756.html",positive (stars 4 and 5),0.8125978112220764
证券要闻,2025-08-28 18:00:35,8月28日龙虎榜复盘：“中山东路”4.12亿元净买入中芯国际,东方财富研究中心,8月28日龙虎榜复盘：“中山东路”4.12亿元净买入中芯国际。,"http://stock.eastmoney.com/news/11783,202508283498073451.html",positive (stars 4 and 5),0.887200653553009
证券要闻,2025-08-28 12:54:24,中国人寿首席投资官：对下半年A股市场仍保持乐观 重点关注新质生产力和优质高股息股票的配置,澎湃新闻,【中国人寿首席投资官：对下半年A股市场仍保持乐观 重点关注新质生产力和优质高股息股票的配置】8月28日，中国人寿保险股份有限公司副总裁、首席投资官、董秘刘晖在该公司2025年中期业绩发布会上表示，对下半年的A股市场仍保持乐观，将持续关注市场上涨板块中的板块轮动，比如科技创新、消费制造、先进制造、新消费、出海企业等方向的投资机会。,"http://finance.eastmoney.com/news/1354,202508283497730596.html",positive (stars 4 and 5),0.8368743062019348
证券要闻,2025-08-28 08:53:53,券商中报密集出炉 18家券商净利同比增速均超20%,澎湃新闻,上市券商半年报密集出炉。8月27日晚间，9家券商集中披露了2025年上半年的业绩情况。其中，东吴证券（601555）、华安证券（600909）、华西证券（002926）、东北证券（000686）、信达证券（601059）、第一创业（002797）、山西证券（002500）、锦龙股份（000712）等8家券商，营业收入和净利润均为“双增长”。,"http://finance.eastmoney.com/news/1344,202508283497248634.html",positive (stars 4 and 5),0.9139301180839539
证券要闻,2025-08-28 12:50:46,买入200股要近30万元！寒武纪再超贵州茅台：半个交易日股价涨了近100元,每日经济新闻,【买入200股要近30万元！寒武纪再超贵州茅台：半个交易日股价涨了近100元】8月28日午间收盘，寒武纪报收1469.99元，买入200股需要29.4万元现金（科创板申报买入200股起），公司总市值也达到了6150亿元，半个交易日股价上涨了97.89元。同时，贵州茅台早盘一度翻绿，今日早盘最高价1452.16元。继昨日之后，寒武纪再次盘中超越茅台成为A股第一高价股！,"http://finance.eastmoney.com/news/1354,202508283497729091.html",positive (stars 4 and 5),0.735130250453949
证券要闻,2025-08-28 12:41:53,2025智博会｜3000+创新产品集结重庆！2025世界智能产业博览会亮点提前剧透,上游新闻,8月28日，2025世界智能产业博览会第二场新闻发布会举行。现场，重庆市经济信息委主任王志杰表示，2025世界智能产业博览会聚焦“人工智能+”和“智能网联新能源汽车”年度主题，以人工智能为主线，精心举办开幕式、生态大会、专业展览、专业赛事、成果发布、产业交流对接等系列活动，全方位展现人工智能赋能产业发展的新特征新热点。,"http://finance.eastmoney.com/news/1353,202508283497730334.html",positive (stars 4 and 5),0.8332562446594238
证券要闻,2025-08-28 12:40:40,美政府考虑入股军工企业！“盯上”这家企业,证券时报,美政府考虑入股军工企业。在宣布入股美国芯片企业英特尔后，美国联邦政府又盯上了美国军工巨头洛克希德·马丁公司。据美国媒体当地时间26日报道，美国商务部长卢特尼克披露，特朗普政府有兴趣收购军工企业的股权，正考虑是否要入股美国顶级国防承包商。就在几天前，美国芯片制造商英特尔公司宣布与美国政府达成协议，美国政府将向英特尔普通股投资89亿美元，收购该公司9.9%的股份。,"http://finance.eastmoney.com/news/1354,202508283497730789.html",positive (stars 4 and 5),0.8627065420150757
证券要闻,2025-08-28 12:30:10,上市公司布局宠物药赛道 能否打开新的增长空间？,证券时报网,当宠物已经成为“家人”，它们的生老病死，催热了宠物医疗市场，一批人用药上市公司看准商机，纷纷入局。近日，多家从事宠物医药业务的企业在接受证券时报记者采访时表示，在需求驱动之下，当前宠物药行业正在从“小众赛道”转向“必争之地”，众多人用药企业跃跃欲试。不过市场升温的另一面，是行业仍需跨越的挑战，打破进口药品和疫苗垄断格局、加速国产替代，成为行业重点突破方向。,"http://finance.eastmoney.com/news/1354,202508283497728873.html",positive (stars 4 and 5),0.8586754202842712
证券要闻,2025-08-28 12:03:00,外资加速进场扫货！4只A股被买爆 还有公司前十大股东中7家变外资,华夏时报,A股作为全球资本市场估值洼地，外资巨头正加速进场。8月26日晚间，安记食品（603696.SH）发布中期业绩显示，公司上半年实现营收3.09亿元，同比增长8.54%；归母净利润1379.08万元，同比增长58.61%。,"http://finance.eastmoney.com/news/1354,202508283497724021.html",positive (stars 4 and 5),0.9342063665390015
证券要闻,2025-08-28 11:51:00,午评：科创50指数上涨3.67%  芯片股集体大涨,新华财经,新华财经北京8月28日电（王媛媛）市场早盘震荡反弹，创业板领涨，科创50指数涨超3%。截至午间收盘，沪指报3803.08点，涨0.07%，成交7662亿元；深证成指报12364.34点，涨0.56%，成交10237亿元；创业板指报2757.41点，涨1.26%，成交5055亿元；科创50指数大涨3.67%，报1319.28点。,"http://finance.eastmoney.com/news/1353,202508283497717854.html",positive (stars 4 and 5),0.7714977860450745
证券要闻,2025-08-28 11:44:58,社保基金连续持有37股 最长已持有51个季度,证券时报网,财报季，机构持股动向逐渐浮出水面，社保基金二季度末共现身396只股，其中，37股已连续持有超20个季度。作为风格稳健的长期机构投资者，社保基金长线持有的重仓股引人关注，据证券时报·数据宝统计，截至8月28日，公布半年报公司中，社保基金最新出现在396家公司前十大流通股东榜，向前追溯发现，共有204只股获社保基金连续持有4个季度以上。,"http://finance.eastmoney.com/news/1353,202508283497716918.html",positive (stars 4 and 5),0.9071953892707825
证券要闻,2025-08-28 11:44:50,基金8月27日参与44家公司的调研活动,证券时报网,昨日基金共对44家公司进行调研，扎堆调研银轮股份、深南电路、东方钽业等。证券时报·数据宝统计，8月27日共56家公司被机构调研，按调研机构类型看，基金参与44家公司的调研活动，其中，10家以上基金扎堆调研公司共13家。银轮股份最受关注，参与调研的基金达36家；深南电路、东方钽业等分别获33家、25家基金集体调研。,"http://finance.eastmoney.com/news/1354,202508283497717024.html",positive (stars 4 and 5),0.6884689927101135
证券要闻,2025-08-28 11:44:41,短线防风险 298只个股短期均线现死叉,证券时报网,证券时报·数据宝统计，截至上午10:29，上证综指3812.43点，涨跌幅为0.32%，A股总成交额为12309.80亿元。到目前为止，今日有298只A股的5日均线主动下穿10日均线，其中绿田机械、雄塑科技、华绿生物等个股的5日均线较10日均线距离最大，分别达-1.85%、-1.54%、-1.51%。,"http://finance.eastmoney.com/news/1353,202508283497715962.html",positive (stars 4 and 5),0.8091903924942017
证券要闻,2025-08-28 11:44:40,【盘中播报】23只个股跨越牛熊分界线,证券时报网,证券时报·数据宝统计，截至今日上午10:29，上证综指3812.43点，收于年线之上，涨跌幅为0.32%，A股总成交额为12309.80亿元。到目前为止，今日有23只A股价格突破了年线，其中乖离率较大的个股有创意信息、中孚信息、齐峰新材等，乖离率分别为11.29%、5.02%、3.05%；贵州轮胎、安迪苏、海尔智家等个股乖离率较小，刚刚站上年线。,"http://finance.eastmoney.com/news/1353,202508283497715840.html",positive (stars 4 and 5),0.8725296854972839
证券要闻,2025-08-28 11:44:38,今日358只个股突破五日均线,证券时报网,证券时报·数据宝统计，截至今日上午10:29，上证综指3812.43点，收于五日均线之下，涨跌幅0.32%，A股总成交额为12309.80亿元。到目前为止，今日有358只A股价格突破了五日均线，其中乖离率较大的个股有艾比森、思泰克、创意信息等，乖离率分别为14.18%、11.25%、9.18%；洋河股份、海尔智家、盐湖股份等个股乖离率较小，刚刚站上五日均线。,"http://finance.eastmoney.com/news/1353,202508283497715782.html",positive (stars 4 and 5),0.8760949969291687
证券要闻,2025-08-28 11:43:00,35亿+分红潮下，谁是私募圈的“现金牛”？,财联社,财联社8月28日讯（记者吴雨其）随着市场震荡上行、产品净值回暖，一轮以兑现收益为主旨的私募分红潮正在悄然展开。据私募排排网不完全统计，截至2025年7月底，在有业绩记录的5017只私募证券产品中，共有197只产品实现分红，合计分红金额高达35.39亿元。无论是金额体量还是机构参与度，都远超以往月度水平。,"http://finance.eastmoney.com/news/1353,202508283497989316.html",positive (stars 4 and 5),0.8952654600143433
证券要闻,2025-08-28 11:38:01,资管机构拥抱被动投资浪潮 共同破局低利率时代“资产荒”,21世纪经济报道,8月16日，由南方财经全媒体集团指导，21世纪经济报道主办、浦发银行联合主办的“2025资产管理年会”在上海浦东隆重举办。近年来，被动投资加速崛起，指数化投资成为大体量资金配置的重要选择，资管机构如何拥抱被动投资浪潮成为行业关注的焦点。,"http://finance.eastmoney.com/news/1353,202508283498503952.html",positive (stars 4 and 5),0.904830276966095
证券要闻,2025-08-28 11:37:47,博时基金宏观策略部王橹舟：下半年关注两大资产配置主线,21世纪经济报道,在近期召开的“2025资产管理年会”上，博时基金宏观策略部体系化投资研究负责人兼基金经理王橹舟发表了对当前市场的看法以及策略建议。王橹舟从偏量化视角，围绕低利率环境下资产配置策略展开分析。,"http://finance.eastmoney.com/news/1353,202508283498504077.html",positive (stars 4 and 5),0.9417248368263245
证券要闻,2025-08-28 11:37:27,港股前七月IPO集资额同比激增610% 虚拟资产现货ETF持续扩容至9只,财联社,"财联社8月28日讯香港证监会昨日公布了2025年4月至6月的《季度报告》，其中指出香港的首次公开招股活动及证券市场表现蓬勃。今年前七个月，香港巩固了其新股市场的全球领导地位：首次公开招股有51宗，集资额按年急增超过610%至1,280亿元。截至7月底，有超过220宗首次公开招股申请正在审批。","http://finance.eastmoney.com/news/1353,202508283497989650.html",positive (stars 4 and 5),0.8692917227745056
证券要闻,2025-08-28 17:40:24,8月28日北向资金最新动向（附十大成交股）,东方财富研究中心,交易所最新数据显示，8月28日北向资金共成交3938.09亿元，占两市总成交额的13.26%。寒武纪、工业富联、北方稀土位列沪股通成交前三，成交额分别为25.28亿、22.96亿、20.48亿；中际旭创、新易盛、天孚通信位列深股通成交前三，成交额分别为39.58亿、39.20亿、29.76亿。免责声明：本文基于AI生产，仅供参考，不构成任何投资建议，据此操作风险自担。,"http://stock.eastmoney.com/news/11780,202508283498057923.html",positive (stars 4 and 5),0.8421810269355774
证券要闻,2025-08-28 16:41:45,国家数据局局长：今年还将推出数据产权等十几项产业政策,澎湃新闻,8月28日，在2025中国国际大数据产业博览会（简称“2025数博会”）的开幕式上，国家数据局局长刘烈宏表示，国家数据局会同各地区各部门纵深推进数据要素市场化配置改革，积极推进“人工智能+”行动，充分发挥数据的基础资源作用和创新引擎作用，多措并举推动各项工作取得积极进展。具体来看，一是完善数据基础制度，优化发展环境。,"http://finance.eastmoney.com/news/1345,202508283497994295.html",positive (stars 4 and 5),0.7279989123344421
证券要闻,2025-08-28 11:18:33,A股三大指数走强，芯片股爆发，中芯国际涨超12%,21世纪经济报道,8月28日，A股三大指数集体低开，随后全部翻红。Wind数据显示，截至10:36，沪指涨0.48%，报3818.72点，深证成指涨1.25%，创业板指涨2%。全市超2500只个股下跌，2600只个股上涨。沪深两市成交额连续第67个交易日突破1万亿。芯片股走强，中芯国际涨超12%截至10:44，芯片股震荡走强，科创50涨超4%，中芯国际涨超12%，股价创历史新高。,"http://finance.eastmoney.com/news/1353,202508283497708261.html",positive (stars 4 and 5),0.7811331748962402
证券要闻,2025-08-28 14:47:07,【风口研报】新政催化千帆星座密集发射 卫星通信或步入商业爆发期,东方财富研究中心,工信部近日印发《关于优化业务准入促进卫星通信产业发展的指导意见》，提出到2030年，发展卫星通信用户超千万，推动卫星通信充分融入新发展格局。机构表示，受国家政策、技术进步和市场需求等因素驱动，卫星互联网行业正处于高速发展期，未来发展前景广阔。,"http://stock.eastmoney.com/news/1405,202508283497909768.html",positive (stars 4 and 5),0.6331080198287964
证券要闻,2025-08-28 18:56:35,马斯克旗下星链又一里程碑：全球用户突破700万！,财联社,当地时间周三，马斯克旗下基于近地轨道的卫星互联网服务“星链”（Starlink）宣布，其全球用户数量已突破700万，目前其业务遍及全球150多个国家和地区。“星链在150多个国家、地区和许多其他市场为700多万人提供可靠的高速互联网。感谢我们在世界各地的用户！”星链在X平台上的官方账号发帖称。,"http://finance.eastmoney.com/news/1345,202508283498110628.html",positive (stars 4 and 5),0.8276286125183105
证券要闻,2025-08-28 11:03:56,高毅、玄元、重阳重仓股大曝光！百亿私募443亿元都买了啥？,界面新闻,随着上市公司中报陆续披露，百亿私募最新的持仓情况备受市场关注。Wind数据显示，截至8月27日，共有28家百亿私募旗下产品出现在已披露中报的上市公司前十大流通股东中，累计持仓市值为443.25亿元，其中有6家百亿私募旗下产品持仓总市值超过了18亿元。,"http://finance.eastmoney.com/news/1353,202508283497702760.html",positive (stars 4 and 5),0.906169056892395
证券要闻,2025-08-28 17:23:03,低基数带来19倍利润增速 北方稀土2000亿市值能否延续？,21世纪经济报道,8月28日，北方稀土再次大涨5%，公司总市值重返2000亿元，逼近2021年9月的历史前高。股价的强劲表现，与公司日前披露的中期业绩有关。在这份半年报中，公司营收、盈利等主要经营指标结束了2023年、2024年连续两年下滑，重归增长。其中，公司归母净利润、扣非后净利润受到去年同期低基数，以及今年主营产品量价齐升的影响，出现了1951.52%和5644.93%的夸张增幅。,"http://finance.eastmoney.com/news/1354,202508283498041218.html",positive (stars 4 and 5),0.8944681882858276
证券要闻,2025-08-28 17:38:36,多家猪企半年报出炉！龙头企业业绩突出,证券时报,在猪价走势继续低迷的背景下，多家上市猪企近日密集披露2025年半年报。相关半年报显示，行业内上市企业业绩表现总体稳健，其中龙头企业业绩表现相对更为突出。上市猪企半年报集中披露龙头企业业绩突出近日，A股市场2025年半年报披露节奏加速，多家上市猪企的半年报也集中浮出水面。数据显示，在申万行业分类之下的生猪养殖行业中，已有超过半数公司披露2025年半年报。,"http://finance.eastmoney.com/news/1354,202508283498058443.html",positive (stars 4 and 5),0.9001222252845764
证券要闻,2025-08-28 10:54:55,华为预告三折叠新品；小米2030年要成大家电头部丨科技风向标,21世纪经济报道,21世纪经济报道新质生产力研究院综合报道早上好，新的一天又开始了。在过去的24小时内，科技行业发生了哪些有意思的事情？来跟21tech一起看看吧。【巨头风向标】华为预告三折叠新品8月27日，华为发布华为MateXTs非凡大师及全场景新品发布会海报，官宣将于9月4日正式举办新品发布会，华为新款三折叠手机将在此次发布会上亮相。,"http://finance.eastmoney.com/news/1353,202508283497694754.html",positive (stars 4 and 5),0.7573961615562439
证券要闻,2025-08-28 14:44:33,同比猛增225%！比亚迪7月在欧销量比特斯拉高出五成,财联社,由于马斯克今年一系列政治行为持续引发欧洲消费者反感，特斯拉在过去大半年里始终未能走出在欧销量大幅下滑的泥潭。而与此同时，以比亚迪为代表的中国电动车企则正在持续发力……欧洲汽车制造商协会(ACEA)周四公布的最新数据显示，7月份比亚迪车型在欧盟的新车注册量同比增长了206.4%，达到9698辆。,"http://finance.eastmoney.com/news/1354,202508283497902823.html",positive (stars 4 and 5),0.9154011607170105
证券要闻,2025-08-28 10:52:41,104只个股连续5日或5日以上获主力资金净买入,证券时报网,据Wind统计，截至8月27日，沪深两市共有104只个股连续5日或5日以上获主力资金净买入。连续获主力资金净买入天数最多的股票是中国动力，已连续15个交易日获净买入；连续获主力资金净买入天数较多的还有三星医疗、银都股份、华曙高科、益佰制药、柏楚电子、华塑股份、中控技术、芯碁微装等股。,"http://finance.eastmoney.com/news/1354,202508283497692643.html",positive (stars 4 and 5),0.7628158330917358
证券要闻,2025-08-28 01:38:52,两融余额突破2.2万亿 31只绩优低估值股获加仓,证券时报,【两融余额突破2.2万亿 31只绩优低估值股获加仓】融资净买入超1亿元的股票中，按照半年报、业绩快报计算，2025年上半年净利润同比增长超20%（含扭亏为盈），同时滚动市盈率低于30倍的个股有31只。,"http://finance.eastmoney.com/news/1353,202508283496958496.html",positive (stars 4 and 5),0.8179535865783691
证券要闻,2025-08-28 10:48:32,半导体ETF涨近5% 机构建议关注国产算力及其配套产业链,东方财富证券,【半导体ETF涨近5% 机构建议关注国产算力及其配套产业链】截至2025年8月28日 10:46，国证半导体芯片指数(980017)强势上涨5.15%，成分股中芯国际(688981)上涨12.81%，瑞芯微(603893)上涨9.92%，澜起科技(688008)上涨8.00%，寒武纪(688256)，龙芯中科(688047)等个股跟涨。半导体ETF(159813)上涨4.95%，最新价报1.06元。,"http://finance.eastmoney.com/news/1353,202508283497737615.html",positive (stars 4 and 5),0.8245179653167725
